{
  "$schema": "http://json-schema.org/draft-07/schema#",
  "$id": "https://trading-platform.io/schemas/funding_window.v1.schema.json",
  "title": "Funding Window V1",
  "description": "Risk window for funding rate events",
  "type": "object",
  "properties": {
    "version": {
      "type": "string",
      "pattern": "^\\d+\\.\\d+\\.\\d+$",
      "description": "Schema version in semver format"
    },
    "venue": {
      "type": "string",
      "description": "Exchange/venue name",
      "examples": ["binance", "bybit", "okx"]
    },
    "symbol": {
      "type": "string",
      "description": "Trading pair symbol",
      "examples": ["BTCUSDT", "ETHUSDT"]
    },
    "funding_time": {
      "type": "string",
      "format": "date-time",
      "pattern": "^\\d{4}-\\d{2}-\\d{2}T\\d{2}:\\d{2}:\\d{2}(\\.\\d{3})?Z$",
      "description": "Time of the funding rate event"
    },
    "current_rate": {
      "type": "number",
      "description": "Current funding rate percentage"
    },
    "predicted_rate": {
      "type": ["number", "null"],
      "description": "Predicted next funding rate percentage"
    },
    "window_start": {
      "type": "string",
      "format": "date-time",
      "pattern": "^\\d{4}-\\d{2}-\\d{2}T\\d{2}:\\d{2}:\\d{2}(\\.\\d{3})?Z$",
      "description": "Start of the risk window (typically 30min before funding)"
    },
    "window_end": {
      "type": "string",
      "format": "date-time",
      "pattern": "^\\d{4}-\\d{2}-\\d{2}T\\d{2}:\\d{2}:\\d{2}(\\.\\d{3})?Z$",
      "description": "End of the risk window (typically 15min after funding)"
    },
    "is_active": {
      "type": "boolean",
      "description": "Whether the risk window is currently active"
    },
    "risk_level": {
      "type": "string",
      "enum": ["low", "medium", "high"],
      "description": "Risk level based on funding rate magnitude"
    }
  },
  "required": [
    "version",
    "venue",
    "symbol",
    "funding_time",
    "current_rate",
    "predicted_rate",
    "window_start",
    "window_end",
    "is_active",
    "risk_level"
  ],
  "additionalProperties": false
}